{
  "$schema": "https://json-schema.org/draft/2020-12/schema",
  "$id": "https://github.com/HomenShum/node-platform/blob/main/schemas/nodekit.evolution-evidence.v1.schema.json",
  "type": "object",
  "required": [
    "schemaVersion",
    "id",
    "kind",
    "artifactRef",
    "sha256",
    "sourceCommit",
    "generatedAt",
    "verifiesInvariantIds",
    "result"
  ],
  "properties": {
    "schemaVersion": {
      "const": "nodekit.evolution-evidence/v1"
    },
    "id": {
      "$ref": "#/$defs/id"
    },
    "supersedesEvidenceId": {
      "$ref": "#/$defs/id",
      "description": "The evidence record this one replaces. The ledger authority is append-or-supersede, but until this field existed supersession was inexpressible for evidence, so a record whose claim turned out to be wrong could only be edited in place. Editing rewrites history and, until evolution verify compared records against the revision that introduced them, nothing noticed. Set this instead of changing a committed claim."
    },
    "kind": {
      "enum": [
        "test",
        "benchmark",
        "code",
        "trace",
        "screenshot",
        "interaction-clip",
        "artifact",
        "deployment",
        "human-review"
      ]
    },
    "artifactRef": {
      "$ref": "#/$defs/text"
    },
    "sha256": {
      "$ref": "#/$defs/hash"
    },
    "sourceCommit": {
      "$ref": "#/$defs/sha"
    },
    "generatedAt": {
      "$ref": "#/$defs/time"
    },
    "command": {
      "$ref": "#/$defs/text"
    },
    "environment": {
      "type": "object",
      "additionalProperties": {
        "type": "string"
      }
    },
    "verifiesInvariantIds": {
      "$ref": "#/$defs/ids"
    },
    "nodeProofReceiptId": {
      "$ref": "#/$defs/text"
    },
    "result": {
      "enum": [
        "pass",
        "fail",
        "partial",
        "informational"
      ]
    },
    "historicalResolution": {
      "type": "object",
      "additionalProperties": false,
      "required": [
        "kind",
        "recordId",
        "recordPath",
        "introducedCommit",
        "editedCommit",
        "originalRecordDigest",
        "acknowledgedRecordDigest",
        "changedFields",
        "authorityDirective"
      ],
      "properties": {
        "kind": {
          "const": "historical-assumption-dimensions-added"
        },
        "recordId": {
          "const": "asm:strong-model-infers-topology"
        },
        "recordPath": {
          "const": "evolution/assumptions/asm-strong-model-infers-topology.json"
        },
        "introducedCommit": {
          "$ref": "#/$defs/sha"
        },
        "editedCommit": {
          "$ref": "#/$defs/sha"
        },
        "originalRecordDigest": {
          "$ref": "#/$defs/hash"
        },
        "acknowledgedRecordDigest": {
          "$ref": "#/$defs/hash"
        },
        "changedFields": {
          "const": [
            "dimensionsTested"
          ]
        },
        "authorityDirective": {
          "type": "object",
          "additionalProperties": false,
          "required": [
            "ref",
            "sha256",
            "assurance"
          ],
          "properties": {
            "ref": {
              "$ref": "#/$defs/text"
            },
            "sha256": {
              "$ref": "#/$defs/hash"
            },
            "assurance": {
              "const": "operator-directed-in-session"
            }
          }
        }
      }
    }
  },
  "$defs": {
    "id": {
      "type": "string",
      "pattern": "^[a-z][a-z0-9._:-]+$"
    },
    "text": {
      "type": "string",
      "minLength": 1
    },
    "ids": {
      "type": "array",
      "items": {
        "$ref": "#/$defs/id"
      },
      "uniqueItems": true
    },
    "hash": {
      "type": "string",
      "pattern": "^[a-f0-9]{64}$"
    },
    "sha": {
      "type": "string",
      "pattern": "^[a-f0-9]{40}$"
    },
    "time": {
      "type": "string",
      "pattern": "^\\d{4}-\\d{2}-\\d{2}T"
    }
  },
  "additionalProperties": false,
  "allOf": [
    {
      "if": {
        "required": [
          "historicalResolution"
        ]
      },
      "then": {
        "properties": {
          "kind": {
            "const": "artifact"
          },
          "result": {
            "const": "informational"
          },
          "verifiesInvariantIds": {
            "maxItems": 0
          }
        }
      }
    }
  ]
}
